Date	Time	Status	Module Affected	Message
2024-06-21	09:12:45	INFO	DB	User john logged in
2024-06-21	10:15:32	DEBUG	DB	User alice queried data
2024-06-22	11:05:18	ERROR	AUTH	Failed login for user mark
2024-06-22	12:00:00	WARN	API	API rate limit reached
2024-06-23	08:45:12	INFO	DB	User john logged out
2024-06-23	13:20:10	ERROR	AUTH	Failed login for user alice
2024-06-24	10:15:32	DEBUG	DB	User mark logged in
2024-06-24	11:30:00	INFO	API	Service started
2024-06-25	14:22:55	WARN	DB	Database connection slow
2024-06-25	15:10:00	INFO	AUTH	User john changed password
2024-06-25	16:40:33	ERROR	API	API timeout for user mark
2024-06-26	09:00:00	INFO	DB	User alice logged in
2024-06-26	10:30:12	WARN	API	Deprecated endpoint used
2024-06-27	12:15:45	ERROR	AUTH	Failed login for user john
2024-06-28	13:50:00	DEBUG	DB	User mark queried data
2024-06-28	14:05:22	INFO	API	Service stopped
